{
  "$schema": "https://json-schema.org/draft/2020-12/schema",
  "type": "object",
  "properties": {
    "$schema": {
      "type": "string"
    },
    "defaultBranch": {
      "type": "string",
      "minLength": 1,
      "description": "The branch pull requests merge into; main when absent"
    },
    "gates": {
      "type": "object",
      "properties": {
        "ci": {
          "type": "array",
          "prefixItems": [
            {
              "$ref": "#/$defs/Command"
            }
          ],
          "minItems": 1,
          "items": {
            "$ref": "#/$defs/Command"
          },
          "description": "The commands CI runs on every pull request to the default branch, each one plain command"
        },
        "scheduled": {
          "type": "array",
          "items": {
            "$ref": "#/$defs/Command"
          },
          "description": "The commands a cron-scheduled workflow runs"
        },
        "lint": {
          "type": "array",
          "items": {
            "type": "string",
            "enum": [
              "checks-lint-coverage",
              "checks-test-layout",
              "checks-commit-identity",
              "checks-comment-gate",
              "checks-suppressions-ratchet",
              "checks-ci-wiring",
              "checks-docs",
              "checks-quality",
              "checks-size-budget",
              "checks-feature-owners"
            ]
          },
          "allOf": [
            {
              "contains": {
                "const": "checks-commit-identity"
              }
            },
            {
              "contains": {
                "const": "checks-comment-gate"
              }
            },
            {
              "contains": {
                "const": "checks-suppressions-ratchet"
              }
            },
            {
              "contains": {
                "const": "checks-ci-wiring"
              }
            },
            {
              "contains": {
                "const": "checks-docs"
              }
            }
          ]
        }
      },
      "additionalProperties": false
    },
    "commitIdentity": {
      "type": "object",
      "properties": {
        "authors": {
          "type": "array",
          "prefixItems": [
            {
              "$ref": "#/$defs/Identity"
            }
          ],
          "minItems": 1,
          "items": {
            "$ref": "#/$defs/Identity"
          },
          "description": "The identities allowed to author and commit, in place of the kit's default owner"
        }
      },
      "required": [
        "authors"
      ],
      "additionalProperties": false
    },
    "sources": {
      "type": "object",
      "properties": {
        "production": {
          "type": "array",
          "items": {
            "$ref": "#/$defs/PathGlob"
          },
          "description": "The source the repository ships, as against tests and tooling"
        },
        "effect": {
          "type": "object",
          "properties": {
            "paths": {
              "type": "array",
              "prefixItems": [
                {
                  "$ref": "#/$defs/PathGlob"
                }
              ],
              "minItems": 1,
              "items": {
                "$ref": "#/$defs/PathGlob"
              },
              "description": "Where source is written in Effect, held to the Effect rules of oxlint and the language service"
            },
            "exempt": {
              "type": "array",
              "items": {
                "$ref": "#/$defs/PathGlob"
              },
              "description": "Files under paths the Effect rules pass over"
            }
          },
          "required": [
            "paths"
          ],
          "additionalProperties": false
        }
      },
      "additionalProperties": false
    },
    "size": {
      "type": "object",
      "properties": {
        "fileLines": {
          "type": "integer",
          "exclusiveMinimum": 0,
          "description": "The most lines a file may hold, blank and comment lines counted"
        },
        "functionLines": {
          "type": "integer",
          "exclusiveMinimum": 0,
          "description": "The most lines a function may span, blank and comment lines counted"
        },
        "applies": {
          "type": "string",
          "enum": [
            "changed",
            "all"
          ],
          "description": "Which production files the budget holds: changed, the ones a range adds or changes; all, every one. The rest are reported as advisory"
        }
      },
      "required": [
        "fileLines",
        "functionLines",
        "applies"
      ],
      "additionalProperties": false,
      "description": "The line budget oxlint holds production files to, read by checks-size-budget"
    },
    "features": {
      "type": "array",
      "items": {
        "type": "object",
        "properties": {
          "name": {
            "type": "string",
            "pattern": "^[a-z0-9]+(?:-[a-z0-9]+)*$",
            "description": "The owner the dependency rule and the change signal name"
          },
          "root": {
            "$ref": "#/$defs/DirectoryPath"
          },
          "entries": {
            "type": "array",
            "prefixItems": [
              {
                "$ref": "#/$defs/FilePath"
              }
            ],
            "minItems": 1,
            "items": {
              "$ref": "#/$defs/FilePath"
            },
            "description": "The files under root that code outside it imports the feature through"
          },
          "allowFrom": {
            "type": "array",
            "items": {
              "$ref": "#/$defs/PathGlob"
            },
            "description": "Files outside root that may import past its entries, such as a CLI or a harness; tests/ always may"
          },
          "proof": {
            "$ref": "#/$defs/ProofPath"
          }
        },
        "required": [
          "name",
          "root",
          "entries",
          "proof"
        ],
        "additionalProperties": false
      }
    },
    "changeSignal": {
      "type": "string",
      "enum": [
        "advisory"
      ],
      "description": "Report which feature owners a change touches, without failing on it"
    },
    "agentRules": {
      "type": "object",
      "properties": {
        "on": {
          "type": "array",
          "items": {
            "$ref": "#/$defs/RuleName"
          },
          "description": "Catalogued Rules switched on here"
        },
        "off": {
          "type": "array",
          "items": {
            "$ref": "#/$defs/RuleName"
          },
          "description": "Catalogued Rules switched off here"
        }
      },
      "additionalProperties": false
    },
    "docs": {
      "type": "object",
      "properties": {
        "pages": {
          "type": "object",
          "properties": {
            "tutorial": {
              "type": "array",
              "items": {
                "$ref": "#/$defs/PathGlob"
              },
              "description": "The pages written as a tutorial, which teaches by building one thing"
            },
            "how-to": {
              "type": "array",
              "items": {
                "$ref": "#/$defs/PathGlob"
              },
              "description": "The pages written as a how-to, which walks one task"
            },
            "reference": {
              "type": "array",
              "items": {
                "$ref": "#/$defs/PathGlob"
              },
              "description": "The pages written as reference, which describes a thing to be looked up"
            },
            "explanation": {
              "type": "array",
              "items": {
                "$ref": "#/$defs/PathGlob"
              },
              "description": "The pages written as an explanation, which says why"
            }
          },
          "additionalProperties": false,
          "description": "The Diátaxis mode of each page, whose template checks-docs holds the page to; a page under docs/ needs one"
        }
      },
      "additionalProperties": false,
      "description": "What checks-docs reads to map a doc file to its template"
    }
  },
  "additionalProperties": false,
  "title": "quality.json",
  "description": "What a repository has opted into from @avi2dg/checks, read by its bins and agent Rule selection",
  "allOf": [
    {
      "if": {
        "required": [
          "size"
        ]
      },
      "then": {
        "required": [
          "sources"
        ],
        "properties": {
          "sources": {
            "required": [
              "production"
            ],
            "properties": {
              "production": {
                "minItems": 1
              }
            }
          }
        }
      }
    },
    {
      "if": {
        "required": [
          "changeSignal"
        ]
      },
      "then": {
        "required": [
          "features"
        ],
        "properties": {
          "features": {
            "minItems": 1
          }
        }
      }
    }
  ],
  "$defs": {
    "Command": {
      "type": "string",
      "minLength": 1
    },
    "Identity": {
      "type": "object",
      "properties": {
        "name": {
          "type": "string",
          "minLength": 1
        },
        "email": {
          "type": "string",
          "minLength": 1
        }
      },
      "required": [
        "name",
        "email"
      ],
      "additionalProperties": false
    },
    "PathGlob": {
      "type": "string",
      "pattern": "^(?!\\.\\.?(?:\\/|$))(?:\\*\\*|(?:[\\w.@+-]|\\*(?!\\*))+)(?:\\/(?!\\.\\.?(?:\\/|$))(?:\\*\\*|(?:[\\w.@+-]|\\*(?!\\*))+))*\\/(?:[\\w.@+-]|\\*(?!\\*))*\\.\\w+$",
      "description": "A glob from the repository root that oxlint, the Effect language service and git read alike: a directory first, * within a segment, ** as a whole one, a file name with an extension last, and no braces, ?, [ or leading ./"
    },
    "DirectoryPath": {
      "type": "string",
      "pattern": "^(?!\\.\\.?(?:\\/|$))[\\w.@+-]+(?:\\/(?!\\.\\.?(?:\\/|$))[\\w.@+-]+)*$",
      "description": "The directory the feature owns"
    },
    "FilePath": {
      "type": "string",
      "pattern": "^(?:(?!\\.\\.?(?:\\/|$))[\\w.@+-]+\\/)*[\\w.@+-]*\\.\\w+$"
    },
    "ProofPath": {
      "type": "string",
      "pattern": "^tests\\/e2e\\/(?:(?!\\.\\.?(?:\\/|$))[\\w.@+-]+\\/)*[\\w.@+-]+\\.test\\.tsx?$",
      "description": "The end-to-end test that imports one of entries"
    },
    "RuleName": {
      "type": "string",
      "pattern": "^[a-z0-9]+(?:-[a-z0-9]+)*$"
    }
  }
}
